lazada,best walking shoes,www.lazada.sg/products/skechers-women-foamies-max-cushioning-walking-shoes-111127-ros-i2776140608.html,Skechers Women Foamies Max Cushioning Walking Shoes - 111127-ROS,5,05-08-2023
lazada,best walking shoes,www.lazada.sg/products/power-women-walking-shoe-509x796-i2658925410.html,Power Women Walking Shoe 509X796,5,05-08-2023
lazada,best walking shoes,www.lazada.sg/products/skechers-online-exclusive-women-sport-social-muse-walking-shoes-8730031-bbk-i2185878671.html,Skechers Online Exclusive Women Sport Social Muse Walking Shoes - 8730031-BBK,5,05-08-2023
lazada,best walking shoes,www.lazada.sg/products/skechers-women-slip-ins-gowalk-6-shoes-124568-bbk-air-cooled-memory-foam-dual-density-hyper-pillar-technology-machine-washable-ultra-go-i2776086665.html,"Skechers Women Slip-Ins GOwalk 6 Shoes - 124568-BBK Air-Cooled Memory Foam Dual-Density, Hyper Pillar Technology, Machine Washable, Ultra Go",5,05-08-2023
lazada,best walking shoes,www.lazada.sg/products/skechers-online-exclusive-women-arch-fit-big-appeal-shoes-149057-gypk-air-cooled-arch-fit-engineered-mesh-machine-washable-vegan-i2683391912.html,"Skechers Online Exclusive Women Arch Fit Big Appeal Shoes - 149057-GYPK Air-Cooled, Arch Fit, Engineered Mesh, Machine Washable, Vegan",5,05-08-2023
lazada,best walking shoes,www.lazada.sg/products/skechers-women-foamies-gowalk-5-astonished-walking-shoes-111103-nat-comfort-pillar-technology-dual-density-machine-washable-i2658528057.html,"Skechers Women Foamies GOwalk 5 Astonished Walking Shoes - 111103-NAT Comfort Pillar Technology, Dual-Density, Machine Washable",5,05-08-2023
lazada,best walking shoes,www.lazada.sg/products/mbt-niwasi-slip-on-unisex-active-fitness-walking-shoes-in-black-i2683125855.html,MBT Niwasi Slip On Unisex Active Fitness Walking Shoes in Black,5,05-08-2023
lazada,best walking shoes,www.lazada.sg/products/skechers-online-exclusive-women-sport-active-arch-fit-refine-dont-go-shoes-104164-slt-arch-fit-machine-washable-stretch-fit-vegan-i2660724707.html,"Skechers Online Exclusive Women Sport Active Arch Fit Refine Don't Go Shoes - 104164-SLT Arch Fit, Machine Washable, Stretch Fit, Vegan",5,05-08-2023
lazada,best walking shoes,www.lazada.sg/products/power-men-primewalk-lace-up-walking-shoes-i2718761145.html,Power Men Primewalk Lace Up Walking Shoes,5,05-08-2023
lazada,best walking shoes,www.lazada.sg/products/mbt-modena-iii-slip-on-unisex-active-fitness-walking-shoes-in-blackblack-i2682728523.html,MBT Modena III Slip On Unisex Active Fitness Walking Shoes in Black/Black,5,05-08-2023
lazada,best walking shoes,www.lazada.sg/products/skechers-women-foamies-footsteps-transcend-shoes-111070-lil-anti-odor-dual-density-hanger-optional-machine-washable-luxe-foam-i2346583821.html,"Skechers Women Foamies Footsteps Transcend Shoes - 111070-LIL Anti-Odor, Dual-Density, Hanger Optional, Machine Washable, Luxe Foam",5,05-08-2023
lazada,best walking shoes,www.lazada.sg/products/skechers-women-gowalk-6-ocean-splash-shoes-124571-bkhp-air-cooled-goga-mat-dual-density-hyper-pillar-technology-machine-washable-ortholite-ultra-go-vegan-i2775988976.html,"Skechers Women GOwalk 6 Ocean Splash Shoes - 124571-BKHP Air-Cooled Goga Mat Dual-Density, Hyper Pillar Technology, Machine Washable, Ortholite, Ultra Go, Vegan",5,05-08-2023
lazada,best walking shoes,www.lazada.sg/products/power-men-breeze-delight-walking-shoes-809x193-i2688218418.html,Power Men Breeze Delight Walking Shoes 809X193,5,05-08-2023
lazada,best walking shoes,www.lazada.sg/products/skechers-women-gowalk-arch-fit-crystal-waves-shoes-124882-tppk-arch-fit-comfort-pillar-technology-machine-washable-ultra-go-i2827991826.html,"Skechers Women GOwalk Arch Fit Crystal Waves Shoes - 124882-TPPK Arch Fit, Comfort Pillar Technology, Machine Washable, Ultra Go",5,05-08-2023
lazada,best walking shoes,www.lazada.sg/products/skechers-online-exclusive-women-work-dighton-slip-resistant-work-shoes-77200-blk-memory-foam-relaxed-fit-i2448014669.html,Skechers Online Exclusive Women Work Dighton Slip Resistant Work Shoes - 77200-BLK Memory Foam Relaxed Fit,5,05-08-2023
lazada,best walking shoes,www.lazada.sg/products/bata-bfirst-unisex-school-shoes-381x571-i1773791381.html,BATA B.FIRST Unisex School Shoes 381X571,5,05-08-2023
