//www.lazada.sg/products/nike-mens-revolution-6-next-nature-running-shoes-black-i1994949062.html,Nike Men's Revolution 6 Next Nature Running Shoes - Black,1,05-08-2023
//www.lazada.sg/products/skechers-online-exclusive-women-sport-dlux-fitness-perfect-timing-shoes-149836-nvmt-air-cooled-memory-foam-relaxed-fit-i2472920392.html,Skechers Online Exclusive Women Sport D'Lux Fitness Perfect Timing Shoes - 149836-NVMT Air-Cooled Memory Foam Relaxed Fit,1,05-08-2023
//www.lazada.sg/products/nike-mens-revolution-6-next-nature-road-running-shoes-midnight-navy-i2035953428.html,Nike Men's Revolution 6 Next Nature  Road Running Shoes - Midnight Navy,1,05-08-2023
//www.lazada.sg/products/nike-mens-downshifter-11-running-shoes-black-i1691279881.html,Nike Men's Downshifter 11 Running Shoes - Black,1,05-08-2023
//www.lazada.sg/products/skechers-online-exclusive-women-sport-skech-lite-pro-high-journey-shoes-149993-gybl-air-cooled-memory-foam-i2427695082.html,Skechers Online Exclusive Women Sport Skech-Lite Pro High Journey Shoes - 149993-GYBL Air-Cooled Memory Foam,1,05-08-2023
//www.lazada.sg/products/nike-womens-revolution-6-next-nature-road-running-shoes-white-i2308687645.html,Nike Women's Revolution 6 Next Nature Road Running Shoes - White,1,05-08-2023
//www.lazada.sg/products/nike-mens-pegasus-40-road-running-shoes-white-i2734075602.html,Nike Men's Pegasus 40 Road Running Shoes - White,1,05-08-2023
//www.lazada.sg/products/skechers-online-exclusive-women-sport-active-gratis-sport-shoes-104286-gylb-air-cooled-memory-foam-i2434228313.html,Skechers Online Exclusive Women Sport Active Gratis Sport Shoes - 104286-GYLB Air-Cooled Memory Foam,1,05-08-2023
//www.lazada.sg/products/skechers-online-exclusive-men-sport-ultra-flex-20-kerlem-shoes-232108-bbk-air-cooled-memory-foam-machine-washable-i1646274881.html,Skechers Online Exclusive Men Sport Ultra Flex 2.0 Kerlem Shoes - 232108-BBK Air-Cooled Memory Foam Machine Washable,1,05-08-2023
//www.lazada.sg/products/nike-womens-experience-run-11-next-nature-road-running-shoes-black-i2653167984.html,Nike Women's Experience Run 11 Next Nature Road Running Shoes - Black,1,05-08-2023
//www.lazada.sg/products/nike-mens-revolution-6-next-nature-running-shoes-black-i1994793953.html,Nike Men's Revolution 6 Next Nature Running Shoes - Black,1,05-08-2023
//www.lazada.sg/products/nike-mens-downshifter-11-running-shoes-black-i1691320764.html,Nike Men's Downshifter 11 Running Shoes - Black,1,05-08-2023
//www.lazada.sg/products/skechers-online-exclusive-men-sport-mira-rylight-shoes-232219-ntmt-air-cooled-memory-foam-i2595614550.html,Skechers Online Exclusive Men Sport Mira Rylight Shoes - 232219-NTMT Air-Cooled Memory Foam,1,05-08-2023
//www.lazada.sg/products/under-armour-ua-womens-charged-breeze-running-shoes-i2528313037.html,Under Armour UA Women's Charged Breeze Running Shoes,1,05-08-2023
//www.lazada.sg/products/nike-womens-revolution-6-next-nature-running-shoes-black-i2147824508.html,Nike Women's Revolution 6 Next Nature Running Shoes - Black,1,05-08-2023
//www.lazada.sg/products/nike-mens-winflo-9-road-running-shoes-black-i2650045834.html,Nike Men's Winflo 9 Road Running Shoes - Black,1,05-08-2023
//www.lazada.sg/products/skechers-online-exclusive-men-sport-mira-shoes-232373-bkw-air-cooled-memory-foam-i2412167151.html,Skechers Online Exclusive Men Sport Mira Shoes - 232373-BKW Air-Cooled Memory Foam,1,05-08-2023
//www.lazada.sg/products/nike-mens-quest-4-road-running-shoes-black-i2614812886.html,Nike Men's Quest 4 Road Running Shoes - Black,1,05-08-2023
//www.lazada.sg/products/nike-womens-flex-experience-run-11-next-nature-road-running-shoes-white-i2480560527.html,Nike Women's Flex Experience Run 11 Next Nature Road Running Shoes - White,1,05-08-2023
//www.lazada.sg/products/nike-womens-free-run-50-running-shoes-sanddrift-i2715891030.html,Nike Women's Free Run 5.0 Running Shoes - Sanddrift,1,05-08-2023
//www.lazada.sg/products/nike-womens-air-zoom-pegasus-37-running-shoes-champagne-i2614908350.html,Nike Women's Air Zoom Pegasus 37 Running Shoes - Champagne,1,05-08-2023
//www.lazada.sg/products/new-balance-running-shoes-suitable-for-flat-feet-i2455131429.html,New Balance Running Shoes (Suitable for Flat Feet),1,05-08-2023
//www.lazada.sg/products/new-balance-shoes-520-white-i2497126019.html,New Balance Shoes (520 - WHITE),1,05-08-2023
//www.lazada.sg/products/nike-womens-flex-experience-run-11-next-nature-road-running-shoes-black-i2272050993.html,Nike Women's Flex Experience Run 11 Next Nature Road Running Shoes - Black,1,05-08-2023
//www.lazada.sg/products/nike-womens-experience-run-11-next-nature-road-running-shoes-pure-platinum-i2653305077.html,Nike Women's Experience Run 11 Next Nature Road Running Shoes - Pure Platinum,1,05-08-2023
//www.lazada.sg/products/skechers-online-exclusive-women-sport-skech-lite-pro-high-journey-shoes-149993-bkw-air-cooled-memory-foam-i2427729008.html,Skechers Online Exclusive Women Sport Skech-Lite Pro High Journey Shoes - 149993-BKW Air-Cooled Memory Foam,1,05-08-2023
//www.lazada.sg/products/hoka-men-arahi-6-wide-running-shoes-harbor-mist-black-i2772564121.html,Hoka Men Arahi 6 Wide Running Shoes - Harbor Mist / Black,1,05-08-2023
//www.lazada.sg/products/skechers-online-exclusive-women-bobs-sport-b-flex-color-connect-walking-shoes-117121-slt-memory-foam-machine-washablestretch-fit-i2440279645.html,"Skechers Online Exclusive Women BOBS Sport B Flex Color Connect Walking Shoes - 117121-SLT Memory Foam Machine Washable,Stretch Fit",1,05-08-2023
//www.lazada.sg/products/puma-unisex-interflex-running-shoes-i1209566917.html,PUMA Unisex INTERFLEX Running Shoes,1,05-08-2023
//www.lazada.sg/products/adidas-running-duramo-9-shoes-men-white-eg8665-i1996246852.html,adidas Running Duramo 9 Shoes Men White EG8665,1,05-08-2023
//www.lazada.sg/products/skechers-boys-gorun-600-zexor-running-shoes-97869l-bbk-lightweight-machine-washable-i2378729574.html,"Skechers Boys GOrun 600 Zexor Running Shoes - 97869L-BBK Lightweight, Machine Washable",1,05-08-2023
//www.lazada.sg/products/nike-mens-winflo-8-road-running-shoes-grey-i2203569800.html,Nike Men's Winflo 8 Road Running Shoes - Grey,1,05-08-2023
//www.lazada.sg/products/adidas-running-run-falcon-20-shoes-women-white-fy9621-i1859749034.html,adidas Running Run Falcon 2.0 Shoes Women White FY9621,1,05-08-2023
//www.lazada.sg/products/hoka-men-clifton-9-wide-running-shoes-vibrant-orange-impala-i2673893276.html,HOKA Men Clifton 9 Wide Running shoes - Vibrant Orange / Impala,1,05-08-2023
//www.lazada.sg/products/on-men-cloud-5-running-shoes-all-black-i2777250910.html,ON Men Cloud 5 Running Shoes - All Black,1,05-08-2023
//www.lazada.sg/products/nike-mens-pegasus-38-road-running-shoes-white-i2831044258.html,Nike Men's Pegasus 38 Road Running Shoes - White,1,05-08-2023
//www.lazada.sg/products/nike-womens-quest-5-road-running-shoes-light-orewood-brown-i2480498663.html,Nike Women's Quest 5 Road Running Shoes - Light Orewood Brown,1,05-08-2023
//www.lazada.sg/products/nike-mens-flex-experience-run-10-road-running-shoes-grey-i2810979261.html,Nike Men's Flex Experience Run 10 Road Running Shoes - Grey,1,05-08-2023
//www.lazada.sg/products/nike-mens-flex-experience-run-10-road-running-shoes-black-i2810966366.html,Nike Men's Flex Experience Run 10 Road Running Shoes - Black,1,05-08-2023
//www.lazada.sg/products/nike-womens-quest-5-road-running-shoes-noise-aqua-i2650065684.html,Nike Women's Quest 5 Road Running Shoes - Noise Aqua,1,05-08-2023
//www.lazada.sg/products/nike-mens-air-zoom-pegasus-37-road-running-shoes-off-noir-i2614817855.html,Nike Men's Air Zoom Pegasus 37 Road Running Shoes - Off Noir,2,05-08-2023
//www.lazada.sg/products/nike-mens-revolution-6-next-nature-running-shoes-black-i1994949062.html,Nike Men's Revolution 6 Next Nature Running Shoes - Black,2,05-08-2023
//www.lazada.sg/products/puma-run-x-frida-1-nitro-women-running-shoes-puma-blackfirelightpuma-team-gold-37662301-i2671237470.html,PUMA Run X Frida 1 Nitro - Women Running Shoes (Puma Black/Firelight/Puma Team Gold) 37662301,2,05-08-2023
//www.lazada.sg/products/asics-running-shoes-i2455120016.html,Asics Running Shoes,2,05-08-2023
//www.lazada.sg/products/under-armour-mens-ua-charged-assert-10-running-shoes-i2848506542.html,Under Armour Men's UA Charged Assert 10 Running Shoes,2,05-08-2023
//www.lazada.sg/products/puma-unisex-flyer-running-shoes-i1209562997.html,PUMA Unisex Flyer Running Shoes,2,05-08-2023
//www.lazada.sg/products/puma-enzo-sport-mens-running-shoes-i1869393761.html,PUMA Enzo Sport Men's Running Shoes,2,05-08-2023
//www.lazada.sg/products/under-armour-mens-ua-charged-impulse-3-knit-running-shoes-i2848511561.html,Under Armour Men's UA Charged Impulse 3 Knit Running Shoes,2,05-08-2023
//www.lazada.sg/products/skechers-online-exclusive-women-sport-active-dlux-comfort-bonus-prize-shoes-104335-gry-air-cooled-memory-foam-machine-washable-relaxed-fit-stretch-fit-vegan-i2373392894.html,"Skechers Online Exclusive Women Sport Active D'Lux Comfort Bonus Prize Shoes - 104335-GRY Air-Cooled Memory Foam Machine Washable, Relaxed Fit, Stretch Fit, Vegan",2,05-08-2023
//www.lazada.sg/products/hoka-men-arahi-6-wide-running-shoes-black-black-i2673914098.html,HOKA Men Arahi 6 Wide Running shoes - Black / Black,2,05-08-2023
//www.lazada.sg/products/skechers-online-exclusive-men-sport-dlux-fitness-roam-free-walking-shoes-232358-tpe-air-cooled-memory-foam-machine-washable-i2355151714.html,Skechers Online Exclusive Men Sport D'Lux Fitness Roam Free Walking Shoes - 232358-TPE Air-Cooled Memory Foam Machine Washable,2,05-08-2023
//www.lazada.sg/products/skechers-online-exclusive-women-sport-skech-lite-pro-high-journey-shoes-149993-gybl-air-cooled-memory-foam-i2427695082.html,Skechers Online Exclusive Women Sport Skech-Lite Pro High Journey Shoes - 149993-GYBL Air-Cooled Memory Foam,2,05-08-2023
//www.lazada.sg/products/nike-mens-revolution-6-next-nature-road-running-shoes-midnight-navy-i2035953428.html,Nike Men's Revolution 6 Next Nature  Road Running Shoes - Midnight Navy,2,05-08-2023
//www.lazada.sg/products/skechers-online-exclusive-men-sport-mira-shoes-232373-bkw-air-cooled-memory-foam-i2412167151.html,Skechers Online Exclusive Men Sport Mira Shoes - 232373-BKW Air-Cooled Memory Foam,2,05-08-2023
//www.lazada.sg/products/puma-softride-fly-mens-running-shoes-black-i2668374592.html,PUMA Softride Fly Men's Running Shoes (Black),2,05-08-2023
//www.lazada.sg/products/nike-mens-revolution-6-next-nature-running-shoes-black-i1994793953.html,Nike Men's Revolution 6 Next Nature Running Shoes - Black,2,05-08-2023
//www.lazada.sg/products/salomon-unisex-glide-max-trail-running-shoes-lunar-rock-black-tanager-turquoise-i2353716619.html,Salomon Unisex Glide Max Trail Running Shoes - Lunar Rock / Black / Tanager Turquoise,2,05-08-2023
//www.lazada.sg/products/hoka-men-arahi-6-wide-running-shoes-harbor-mist-black-i2772564121.html,Hoka Men Arahi 6 Wide Running Shoes - Harbor Mist / Black,2,05-08-2023
//www.lazada.sg/products/nike-mens-renew-ride-3-road-running-shoes-black-i2650122250.html,Nike Men's Renew Ride 3 Road Running Shoes - Black,2,05-08-2023
//www.lazada.sg/products/nike-mens-experience-run-11-next-nature-road-running-shoes-aviator-grey-i2650045831.html,Nike Men's Experience Run 11 Next Nature Road Running Shoes - Aviator Grey,2,05-08-2023
//www.lazada.sg/products/puma-unisex-interflex-running-shoes-i1209566917.html,PUMA Unisex INTERFLEX Running Shoes,2,05-08-2023
//www.lazada.sg/products/skechers-boys-gorun-600-zexor-running-shoes-97869l-bbk-lightweight-machine-washable-i2378729574.html,"Skechers Boys GOrun 600 Zexor Running Shoes - 97869L-BBK Lightweight, Machine Washable",2,05-08-2023
//www.lazada.sg/products/nike-mens-flex-experience-run-11-next-nature-road-running-shoes-black-i2715803479.html,Nike Men's Flex Experience Run 11 Next Nature Road Running Shoes - Black,2,05-08-2023
//www.lazada.sg/products/nike-mens-downshifter-11-running-shoes-black-i1691320764.html,Nike Men's Downshifter 11 Running Shoes - Black,2,05-08-2023
//www.lazada.sg/products/puma-softride-rift-womens-running-shoes-i1869510208.html,PUMA SOFTRIDE Rift Women's Running Shoes,2,05-08-2023
//www.lazada.sg/products/nike-mens-downshifter-11-running-shoes-black-i1691279881.html,Nike Men's Downshifter 11 Running Shoes - Black,2,05-08-2023
//www.lazada.sg/products/skechers-online-exclusive-men-sport-glide-step-sport-walking-shoes-232269-bkmt-air-cooled-memory-foam-glide-step-machine-washable-i2696934634.html,"Skechers Online Exclusive Men Sport Glide-Step Sport Walking Shoes - 232269-BKMT Air-Cooled Memory Foam Glide-Step, Machine Washable",2,05-08-2023
//www.lazada.sg/products/adidas-running-runfalcon-20-shoes-men-black-fz2803-i1859666345.html,adidas Running Runfalcon 2.0 Shoes Men Black FZ2803,2,05-08-2023
//www.lazada.sg/products/nike-mens-downshifter-12-road-running-shoes-black-i2585457332.html,Nike Men's Downshifter 12 Road Running Shoes - Black,2,05-08-2023
//www.lazada.sg/products/nike-mens-quest-4-road-running-shoes-black-i2614812886.html,Nike Men's Quest 4 Road Running Shoes - Black,2,05-08-2023
//www.lazada.sg/products/under-armour-ua-womens-charged-breeze-running-shoes-i2528313037.html,Under Armour UA Women's Charged Breeze Running Shoes,2,05-08-2023
//www.lazada.sg/products/new-balance-shoes-565-i2562270851.html,New Balance Shoes (565),2,05-08-2023
//www.lazada.sg/products/the-north-face-mens-vectiv-eminus-trail-running-shoes-tnf-cone-orange-tnf-black-i2691616688.html,The North Face Men's Vectiv Eminus Trail Running Shoes - TNF Cone Orange / TNF Black,2,05-08-2023
//www.lazada.sg/products/nike-mens-run-swift-3-road-running-shoes-ashen-slate-i2653180818.html,Nike Men's Run Swift 3 Road Running Shoes - Ashen Slate,2,05-08-2023
//www.lazada.sg/products/adidas-running-duramo-9-shoes-men-white-eg8665-i1996246852.html,adidas Running Duramo 9 Shoes Men White EG8665,2,05-08-2023
//www.lazada.sg/products/hoka-women-zinal-running-shoes-radiant-yellow-camellia-i2342705124.html,Hoka Women Zinal Running Shoes - Radiant Yellow / Camellia,2,05-08-2023
//www.lazada.sg/products/nike-mens-downshifter-12-road-running-shoes-platinum-tint-i2650134154.html,Nike Men's Downshifter 12 Road Running Shoes - Platinum Tint,2,05-08-2023
//www.lazada.sg/products/salomon-men-pulsar-trail-running-shoes-poppy-red-biking-red-black-i2353635952.html,Salomon Men Pulsar Trail Running Shoes - Poppy Red / Biking Red / Black,2,05-08-2023
//www.lazada.sg/products/hoka-men-arahi-6-running-shoes-black-flame-i2757534744.html,Hoka Men Arahi 6 Running Shoes - Black / Flame,2,05-08-2023
//www.lazada.sg/products/puma-enzo-2-metal-womens-running-shoes-i2043601110.html,PUMA Enzo 2 Metal Women's Running Shoes,2,05-08-2023
//www.lazada.sg/products/nike-mens-air-zoom-pegasus-37-road-running-shoes-off-noir-i2614817855.html,Nike Men's Air Zoom Pegasus 37 Road Running Shoes - Off Noir,3,05-08-2023
//www.lazada.sg/products/nike-mens-revolution-6-next-nature-running-shoes-black-i1994949062.html,Nike Men's Revolution 6 Next Nature Running Shoes - Black,3,05-08-2023
//www.lazada.sg/products/skechers-online-exclusive-women-sport-dlux-fitness-roam-free-shoes-149835-bkmt-air-cooled-memory-foam-machine-washable-relaxed-fit-vegan-i2448117385.html,"Skechers Online Exclusive Women Sport D'Lux Fitness Roam Free Shoes - 149835-BKMT Air-Cooled Memory Foam Machine Washable, Relaxed Fit, Vegan",3,05-08-2023
//www.lazada.sg/products/skechers-online-exclusive-women-sport-dlux-fitness-perfect-timing-shoes-149836-nvmt-air-cooled-memory-foam-relaxed-fit-i2472920392.html,Skechers Online Exclusive Women Sport D'Lux Fitness Perfect Timing Shoes - 149836-NVMT Air-Cooled Memory Foam Relaxed Fit,3,05-08-2023
//www.lazada.sg/products/nike-mens-free-run-50-road-running-shoes-oxygen-purple-i2802003186.html,Nike Men's Free Run 5.0 Road Running Shoes - Oxygen Purple,3,05-08-2023
//www.lazada.sg/products/skechers-online-exclusive-women-sport-graceful-20-joy-space-walking-shoes-8730018-gylp-memory-foam-i2185972097.html,Skechers Online Exclusive Women Sport Graceful 2.0 Joy-Space Walking Shoes - 8730018-GYLP Memory Foam,3,05-08-2023
//www.lazada.sg/products/under-armour-mens-ua-charged-assert-10-running-shoes-i2848506542.html,Under Armour Men's UA Charged Assert 10 Running Shoes,3,05-08-2023
//www.lazada.sg/products/skechers-online-exclusive-women-sport-active-gratis-sport-shoes-104286-gylb-air-cooled-memory-foam-i2434228313.html,Skechers Online Exclusive Women Sport Active Gratis Sport Shoes - 104286-GYLB Air-Cooled Memory Foam,3,05-08-2023
//www.lazada.sg/products/skechers-online-exclusive-women-sport-dlux-walker-fresh-finesse-shoes-149368-bkpr-air-cooled-memory-foam-engineered-mesh-machine-washable-relaxed-fit-vegan-i2448153201.html,"Skechers Online Exclusive Women Sport D'Lux Walker Fresh Finesse Shoes - 149368-BKPR Air-Cooled Memory Foam Engineered Mesh, Machine Washable, Relaxed Fit, Vegan",3,05-08-2023
//www.lazada.sg/products/skechers-online-exclusive-women-bobs-sport-b-flex-color-connect-walking-shoes-117121-slt-memory-foam-machine-washablestretch-fit-i2440279645.html,"Skechers Online Exclusive Women BOBS Sport B Flex Color Connect Walking Shoes - 117121-SLT Memory Foam Machine Washable,Stretch Fit",3,05-08-2023
//www.lazada.sg/products/skechers-online-exclusive-women-sport-active-dlux-comfort-bonus-prize-shoes-104335-gry-air-cooled-memory-foam-machine-washable-relaxed-fit-stretch-fit-vegan-i2373392894.html,"Skechers Online Exclusive Women Sport Active D'Lux Comfort Bonus Prize Shoes - 104335-GRY Air-Cooled Memory Foam Machine Washable, Relaxed Fit, Stretch Fit, Vegan",3,05-08-2023
//www.lazada.sg/products/skechers-online-exclusive-women-bobs-sport-b-flex-color-connect-walking-shoes-117121-lav-memory-foam-machine-washablestretch-fit-i2440273848.html,"Skechers Online Exclusive Women BOBS Sport B Flex Color Connect Walking Shoes - 117121-LAV Memory Foam Machine Washable,Stretch Fit",3,05-08-2023
//www.lazada.sg/products/skechers-women-sport-graceful-20-sanya-shoes-8730082-bkw-memory-foam-i2758257170.html,Skechers Women Sport Graceful 2.0 Sanya Shoes - 8730082-BKW Memory Foam,3,05-08-2023
//www.lazada.sg/products/puma-unisex-flyer-running-shoes-i1209562997.html,PUMA Unisex Flyer Running Shoes,3,05-08-2023
//www.lazada.sg/products/puma-enzo-sport-mens-running-shoes-i1869393761.html,PUMA Enzo Sport Men's Running Shoes,3,05-08-2023
//www.lazada.sg/products/skechers-online-exclusive-women-sport-lander-s-sweet-remix-shoes-149896-pklv-air-cooled-memory-foam-goodyear-rubber-i2434274022.html,Skechers Online Exclusive Women Sport Lander S Sweet Remix Shoes - 149896-PKLV Air-Cooled Memory Foam Goodyear Rubber,3,05-08-2023
//www.lazada.sg/products/skechers-online-exclusive-women-sport-dlux-fitness-perfect-timing-shoes-149836-bkmt-air-cooled-memory-foam-relaxed-fit-i2472976031.html,Skechers Online Exclusive Women Sport D'Lux Fitness Perfect Timing Shoes - 149836-BKMT Air-Cooled Memory Foam Relaxed Fit,3,05-08-2023
//www.lazada.sg/products/skechers-online-exclusive-women-sport-roseate-look-club-shoes-8730064-wpk-memory-foam-i2758151749.html,Skechers Online Exclusive Women Sport Roseate Look Club Shoes - 8730064-WPK Memory Foam,3,05-08-2023
//www.lazada.sg/products/skechers-women-sport-social-muse-quick-bliss-shoes-8730083-ros-memory-foam-i2784550204.html,Skechers Women Sport Social Muse Quick Bliss Shoes - 8730083-ROS Memory Foam,3,05-08-2023
//www.lazada.sg/products/skechers-women-sport-skech-lite-pro-light-rush-shoes-149944-bkw-air-cooled-memory-foam-machine-washable-vegan-i2801943771.html,"Skechers Women Sport Skech-Lite Pro Light Rush Shoes - 149944-BKW Air-Cooled Memory Foam Machine Washable, Vegan",3,05-08-2023
//www.lazada.sg/products/skechers-online-exclusive-women-sport-skech-air-dynamight-perfect-steps-shoes-149754-bkrg-memory-foam-skech-air-machine-washable-stretch-fit-vegan-i2440367408.html,"Skechers Online Exclusive Women Sport Skech-Air Dynamight Perfect Steps Shoes - 149754-BKRG Memory Foam Skech-Air, Machine Washable, Stretch Fit, Vegan",3,05-08-2023
//www.lazada.sg/products/skechers-online-exclusive-men-sport-dlux-fitness-roam-free-walking-shoes-232358-tpe-air-cooled-memory-foam-machine-washable-i2355151714.html,Skechers Online Exclusive Men Sport D'Lux Fitness Roam Free Walking Shoes - 232358-TPE Air-Cooled Memory Foam Machine Washable,3,05-08-2023
//www.lazada.sg/products/skechers-online-exclusive-men-sport-mira-shoes-232373-bkw-air-cooled-memory-foam-i2412167151.html,Skechers Online Exclusive Men Sport Mira Shoes - 232373-BKW Air-Cooled Memory Foam,3,05-08-2023
//www.lazada.sg/products/skechers-women-sport-graceful-20-sanya-shoes-8730082-mve-memory-foam-i2758234313.html,Skechers Women Sport Graceful 2.0 Sanya Shoes - 8730082-MVE Memory Foam,3,05-08-2023
//www.lazada.sg/products/skechers-online-exclusive-women-sport-skech-lite-pro-high-journey-shoes-149993-gybl-air-cooled-memory-foam-i2427695082.html,Skechers Online Exclusive Women Sport Skech-Lite Pro High Journey Shoes - 149993-GYBL Air-Cooled Memory Foam,3,05-08-2023
//www.lazada.sg/products/skechers-women-sport-graceful-20-sanya-shoes-8730082-tpe-memory-foam-i2784569124.html,Skechers Women Sport Graceful 2.0 Sanya Shoes - 8730082-TPE Memory Foam,3,05-08-2023
//www.lazada.sg/products/nike-mens-revolution-6-next-nature-road-running-shoes-midnight-navy-i2035953428.html,Nike Men's Revolution 6 Next Nature  Road Running Shoes - Midnight Navy,3,05-08-2023
//www.lazada.sg/products/nike-mens-revolution-6-next-nature-running-shoes-black-i1994793953.html,Nike Men's Revolution 6 Next Nature Running Shoes - Black,3,05-08-2023
//www.lazada.sg/products/skechers-women-bobs-sport-squad-air-sweet-encounter-shoes-117379-blk-memory-foam-i2451242377.html,Skechers Women BOBS Sport Squad Air Sweet Encounter Shoes - 117379-BLK Memory Foam,3,05-08-2023
//www.lazada.sg/products/nike-mens-renew-ride-3-road-running-shoes-black-i2650122250.html,Nike Men's Renew Ride 3 Road Running Shoes - Black,3,05-08-2023
//www.lazada.sg/products/nike-mens-experience-run-11-next-nature-road-running-shoes-aviator-grey-i2650045831.html,Nike Men's Experience Run 11 Next Nature Road Running Shoes - Aviator Grey,3,05-08-2023
//www.lazada.sg/products/nike-mens-flex-experience-run-11-next-nature-road-running-shoes-black-i2715803479.html,Nike Men's Flex Experience Run 11 Next Nature Road Running Shoes - Black,3,05-08-2023
//www.lazada.sg/products/nike-mens-downshifter-11-running-shoes-black-i1691320764.html,Nike Men's Downshifter 11 Running Shoes - Black,3,05-08-2023
//www.lazada.sg/products/nike-mens-downshifter-12-road-running-shoes-black-i2585457332.html,Nike Men's Downshifter 12 Road Running Shoes - Black,3,05-08-2023
//www.lazada.sg/products/skechers-women-slip-ins-sport-ultra-flex-30-shoes-149708-ltgy-air-cooled-memory-foam-i2802086227.html,Skechers Women Slip-Ins Sport Ultra Flex 3.0 Shoes - 149708-LTGY Air-Cooled Memory Foam,3,05-08-2023
//www.lazada.sg/products/skechers-boys-gorun-600-zexor-running-shoes-97869l-bbk-lightweight-machine-washable-i2378729574.html,"Skechers Boys GOrun 600 Zexor Running Shoes - 97869L-BBK Lightweight, Machine Washable",3,05-08-2023
//www.lazada.sg/products/nike-mens-quest-4-road-running-shoes-black-i2614812886.html,Nike Men's Quest 4 Road Running Shoes - Black,3,05-08-2023
//www.lazada.sg/products/skechers-online-exclusive-men-sport-glide-step-sport-walking-shoes-232269-bkmt-air-cooled-memory-foam-glide-step-machine-washable-i2696934634.html,"Skechers Online Exclusive Men Sport Glide-Step Sport Walking Shoes - 232269-BKMT Air-Cooled Memory Foam Glide-Step, Machine Washable",3,05-08-2023
//www.lazada.sg/products/skechers-women-max-cushioning-delta-running-shoes-129120-bkbl-air-cooled-goga-mat-nrt-natural-rocker-technology-goodyear-rubber-goodyear-anti-slip-machine-washable-max-cushioning-ortholite-ultra-go-i2401746084.html,"Skechers Women Max Cushioning Delta Running Shoes - 129120-BKBL Air-Cooled Goga Mat NRT - Natural Rocker Technology, Goodyear Rubber, Goodyear Anti-Slip, Machine Washable, Max Cushioning, Ortholite, Ultra Go",3,05-08-2023
//www.lazada.sg/products/nike-mens-downshifter-11-running-shoes-black-i1691279881.html,Nike Men's Downshifter 11 Running Shoes - Black,3,05-08-2023
//www.lazada.sg/products/nike-mens-downshifter-12-road-running-shoes-black-i2585457332.html,Nike Men's Downshifter 12 Road Running Shoes - Black,4,05-08-2023
//www.lazada.sg/products/adidas-running-duramo-sl-shoes-men-white-fw7391-i953586159.html,adidas Running Duramo SL Shoes Men White FW7391,4,05-08-2023
//www.lazada.sg/products/skechers-online-exclusive-women-sport-ultra-flex-30-shoes-149861-ntmt-air-cooled-memory-foam-i2835500931.html,Skechers Online Exclusive Women Sport Ultra Flex 3.0 Shoes - 149861-NTMT Air-Cooled Memory Foam,4,05-08-2023
//www.lazada.sg/products/nike-mens-free-run-50-road-running-shoes-oxygen-purple-i2802003186.html,Nike Men's Free Run 5.0 Road Running Shoes - Oxygen Purple,4,05-08-2023
//www.lazada.sg/products/under-armour-mens-ua-charged-impulse-3-knit-running-shoes-i2848511561.html,Under Armour Men's UA Charged Impulse 3 Knit Running Shoes,4,05-08-2023
//www.lazada.sg/products/skechers-women-gorun-consistent-anahita-running-shoes-128280-ntlp-air-cooled-goga-mat-m-strike-ortholite-ultra-light-cushioning-i2799551004.html,"Skechers Women GOrun Consistent Anahita Running Shoes - 128280-NTLP Air-Cooled Goga Mat M-STRIKE, Ortholite, Ultra Light Cushioning",4,05-08-2023
//www.lazada.sg/products/skechers-men-slip-ins-sport-ultra-flex-30-shoes-232458-nvy-air-cooled-memory-foam-i2802100282.html,Skechers Men Slip-Ins Sport Ultra Flex 3.0 Shoes - 232458-NVY Air-Cooled Memory Foam,4,05-08-2023
//www.lazada.sg/products/under-armour-ua-hovr-phantom-3-men-running-shoes-black-3025516-003-i2850791890.html,Under Armour UA HOVR Phantom 3 - Men Running Shoes (Black) 3025516-003,4,05-08-2023
//www.lazada.sg/products/nike-womens-downshifter-12-road-running-shoes-brown-i2830978506.html,Nike Women's Downshifter 12 Road Running Shoes - Brown,4,05-08-2023
