//www.lazada.sg/products/puma-unisex-smash-vulcanised-v3-low-shoes-i2659292339.html,PUMA Unisex Smash Vulcanised V3 Low Shoes,1,05-08-2023
//www.lazada.sg/products/adidas-tensaur-run-20-younger-kids-school-shoes-black-gz3443-i2752548314.html,Adidas Tensaur Run 2.0 - Younger Kids' School Shoes (Black) GZ3443,1,05-08-2023
//www.lazada.sg/products/skechers-online-exclusive-men-gorun-persistence-running-shoes-246053-blyl-hyper-arc-arch-fit-carbon-infused-goodyear-rubber-ultra-flight-foam-i2448033778.html,"Skechers Online Exclusive Men GOrun Persistence Running Shoes - 246053-BLYL HYPER ARC, Arch Fit, Carbon Infused, Goodyear Rubber, Ultra Flight Foam",1,05-08-2023
//www.lazada.sg/products/nike-kids-omni-multi-court-big-kids-indoor-court-shoes-black-i2715879132.html,Nike Kids' Omni Multi-Court Big Kids Indoor Court Shoes - Black,1,05-08-2023
//www.lazada.sg/products/skechers-men-sport-flection-20-floma-shoes-8790148-nvy-memory-foam-i2784312994.html,Skechers Men Sport Flection 2.0 Floma Shoes - 8790148-NVY Memory Foam,1,05-08-2023
//www.lazada.sg/products/nike-mens-ebernon-low-shoes-black-i2367283182.html,Nike Men's Ebernon Low Shoes - Black,1,05-08-2023
//www.lazada.sg/products/new-balance-shoes-520-black-i2497171147.html,New Balance Shoes (520 - BLACK),1,05-08-2023
//www.lazada.sg/products/nike-mens-court-vision-low-shoes-black-i2148065781.html,Nike Men's Court Vision Low Shoes - Black,1,05-08-2023
//www.lazada.sg/products/nike-womens-air-max-inrtlk-lite-shoes-black-i2650025928.html,Nike Women's Air Max INRTLK Lite Shoes - Black,1,05-08-2023
//www.lazada.sg/products/skechers-online-exclusive-men-sport-ultra-flex-20-kerlem-shoes-232108-bbk-air-cooled-memory-foam-machine-washable-i1646274881.html,Skechers Online Exclusive Men Sport Ultra Flex 2.0 Kerlem Shoes - 232108-BBK Air-Cooled Memory Foam Machine Washable,1,05-08-2023
//www.lazada.sg/products/nike-mens-court-vision-low-next-nature-shoes-black-i2585457331.html,Nike Men's Court Vision Low Next Nature Shoes - Black,1,05-08-2023
//www.lazada.sg/products/nike-mens-court-vision-low-shoes-black-i2650048700.html,Nike Men's Court Vision Low Shoes - Black,1,05-08-2023
//www.lazada.sg/products/converse-chuck-70-hi-unisex-sneakers-oat-milkegretblack-i2730005893.html,Converse Chuck 70 Hi Unisex Sneakers - Oat Milk/Egret/Black,1,05-08-2023
//www.lazada.sg/products/puma-unisex-smash-leather-shoes-i1165168508.html,PUMA Unisex Smash Leather Shoes,1,05-08-2023
//www.lazada.sg/products/nike-mens-court-vision-low-next-nature-shoes-black-i1889791160.html,Nike Men's Court Vision Low Next Nature Shoes - Black,1,05-08-2023
//www.lazada.sg/products/nike-kids-revolution-6-next-nature-jp-shoes-black-i2650156020.html,Nike Kids' Revolution 6 Next Nature JP Shoes - Black,1,05-08-2023
//www.lazada.sg/products/puma-unisex-smash-v2-youth-shoes-i2659193731.html,PUMA Unisex Smash v2 Youth Shoes,1,05-08-2023
//www.lazada.sg/products/under-armour-ua-assert-8-uniform-ac-psv-younger-kids-school-shoes-black-3022698-001-i2601004924.html,Under Armour UA Assert 8 Uniform AC (PSV) - Younger Kids School Shoes (Black) 3022698-001,1,05-08-2023
//www.lazada.sg/products/nike-mens-court-royale-shoes-black-i2582504063.html,Nike Men's Court Royale Shoes - Black,1,05-08-2023
//www.lazada.sg/products/nike-kids-court-borough-low-2-little-kids-shoes-black-i2692696878.html,Nike Kids' Court Borough Low 2 Little Kids Shoes- Black,1,05-08-2023
//www.lazada.sg/products/nike-mens-flight-legacy-shoes-black-i2614931058.html,Nike Men's Flight Legacy Shoes - Black,1,05-08-2023
//www.lazada.sg/products/puma-unisex-x-pokemon-rider-fv-pikachu-sneakers-youth-white-i2759030831.html,PUMA Unisex x POKÉMON Rider FV Pikachu Sneakers Youth (White).,1,05-08-2023
//www.lazada.sg/products/nike-mens-court-legacy-suede-shoes-black-i2162189094.html,Nike Men's Court Legacy Suede Shoes - Black,1,05-08-2023
//www.lazada.sg/products/nike-mens-air-max-systm-shoes-black-i2495552696.html,Nike Men's Air Max SYSTM Shoes - Black,1,05-08-2023
//www.lazada.sg/products/nike-womens-court-royale-shoes-black-i2367256375.html,Nike Women's Court Royale Shoes - Black,1,05-08-2023
//www.lazada.sg/products/nike-mens-challenger-og-shoes-black-i2602218538.html,Nike Men's Challenger OG Shoes - Black,1,05-08-2023
//www.lazada.sg/products/puma-unisex-x-neymar-jr-wild-rider-sneaker-shoe-385048-01-sport-planet-18-13-i2620277523.html,Puma Unisex X Neymar Jr. Wild Rider Sneaker Shoe (385048-01) Sport Planet 18-13,1,05-08-2023
//www.lazada.sg/products/converse-chuck-taylor-all-star-hi-unisex-sneakers-black-i2613543050.html,Converse Chuck Taylor All Star HI Unisex Sneakers - Black,1,05-08-2023
//www.lazada.sg/products/puma-unisex-rebound-lay-up-lo-mesh-shoes-i2086177999.html,PUMA Unisex Rebound Lay-Up Lo Mesh Shoes,1,05-08-2023
//www.lazada.sg/products/nike-mens-air-max-ap-shoes-black-i2650075633.html,Nike Men's Air Max AP Shoes - Black,1,05-08-2023
//www.lazada.sg/products/nike-womens-air-max-2017-shoes-black-i2614873558.html,Nike Women's Air Max 2017 Shoes - Black,1,05-08-2023
//www.lazada.sg/products/on-men-cloud-5-all-day-wear-shoes-black-white-i2669437343.html,ON Men Cloud 5 All Day Wear Shoes - Black / White,1,05-08-2023
//www.lazada.sg/products/on-men-cloud-5-waterproof-all-day-wear-shoes-black-i2669461333.html,ON Men Cloud 5 Waterproof All Day Wear Shoes - Black,1,05-08-2023
//www.lazada.sg/products/timberland-mens-newbury-edge-sneaker-boots-black-wide-i2454392502.html,Timberland Men's Newbury Edge Sneaker Boots Black Wide,1,05-08-2023
//www.lazada.sg/products/timberland-mens-davis-square-sneakers-black-i2815488924.html,Timberland Men's Davis Square Sneakers Black,1,05-08-2023
//www.lazada.sg/products/puma-wired-run-slip-on-metallics-women-sneakers-black-i2639319585.html,PUMA Wired Run Slip-On Metallics Women Sneakers (Black),1,05-08-2023
//www.lazada.sg/products/asics-contend-8-gs-older-kids-school-shoes-black-1014a259-001-i2615071423.html,Asics Contend 8 GS Older Kids' School Shoes (Black) 1014A259-001,1,05-08-2023
//www.lazada.sg/products/nike-womens-tanjun-shoes-black-i2162161283.html,Nike Women's Tanjun Shoes - Black,1,05-08-2023
//www.lazada.sg/products/asics-men-jog-100t-4e-sportstyle-shoes-in-blackblack-i2474634430.html,ASICS Men JOG 100T (4E) Sportstyle Shoes in Black/Black,1,05-08-2023
//www.lazada.sg/products/converse-chuck-taylor-all-star-ox-unisex-sneakers-black-i2613382920.html,Converse Chuck Taylor All Star Ox Unisex Sneakers - Black,1,05-08-2023
//www.lazada.sg/products/nike-kids-omni-multi-court-big-kids-indoor-court-shoes-black-i2715879132.html,Nike Kids' Omni Multi-Court Big Kids Indoor Court Shoes - Black,2,05-08-2023
//www.lazada.sg/products/nike-mens-downshifter-12-road-running-shoes-black-i2585457332.html,Nike Men's Downshifter 12 Road Running Shoes - Black,2,05-08-2023
//www.lazada.sg/products/under-armour-mens-ua-charged-assert-10-running-shoes-i2848506542.html,Under Armour Men's UA Charged Assert 10 Running Shoes,2,05-08-2023
//www.lazada.sg/products/nike-mens-flex-experience-run-11-next-nature-road-running-shoes-black-i2715803479.html,Nike Men's Flex Experience Run 11 Next Nature Road Running Shoes - Black,2,05-08-2023
//www.lazada.sg/products/adidas-running-puremotion-shoes-women-black-h00589-i2426092493.html,adidas Running Puremotion Shoes Women Black H00589,2,05-08-2023
//www.lazada.sg/products/craft-pro-endur-distance-m-gemsolo-1912183-663573-i2749346318.html,CRAFT PRO ENDUR DISTANCE M GEM/SOLO 1912183-663573,2,05-08-2023
//www.lazada.sg/products/craft-pro-endur-distance-m-asphaltash-1912183-995914-i2749256555.html,CRAFT PRO ENDUR DISTANCE M ASPHALT/ASH 1912183-995914,2,05-08-2023
//www.lazada.sg/products/converse-chuck-70-hi-unisex-sneakers-oat-milkegretblack-i2730005893.html,Converse Chuck 70 Hi Unisex Sneakers - Oat Milk/Egret/Black,2,05-08-2023
//www.lazada.sg/products/nike-mens-court-vision-low-next-nature-shoes-black-i2585457331.html,Nike Men's Court Vision Low Next Nature Shoes - Black,2,05-08-2023
//www.lazada.sg/products/skechers-online-exclusive-men-gorun-persistence-running-shoes-246053-blyl-hyper-arc-arch-fit-carbon-infused-goodyear-rubber-ultra-flight-foam-i2448033778.html,"Skechers Online Exclusive Men GOrun Persistence Running Shoes - 246053-BLYL HYPER ARC, Arch Fit, Carbon Infused, Goodyear Rubber, Ultra Flight Foam",2,05-08-2023
//www.lazada.sg/products/nike-mens-court-vision-low-shoes-black-i2650048700.html,Nike Men's Court Vision Low Shoes - Black,2,05-08-2023
//www.lazada.sg/products/skechers-online-exclusive-men-gorun-razor-excess-running-shoes-246004-ylnv-breathable-goodyear-rubber-hyper-burst-i2677390309.html,"Skechers Online Exclusive Men GOrun Razor Excess Running Shoes - 246004-YLNV Breathable, Goodyear Rubber, Hyper Burst",2,05-08-2023
//www.lazada.sg/products/on-men-cloudmonster-running-shoes-iron-hay-i2683847227.html,On Men Cloudmonster Running Shoes - Iron / Hay,2,05-08-2023
//www.lazada.sg/products/new-balance-mens-fresh-foam-arishi-v4-wide-blacktop-i2828468993.html,New Balance Mens Fresh Foam Arishi V4 (Wide) - Blacktop,2,05-08-2023
//www.lazada.sg/products/nike-womens-downshifter-12-road-running-shoes-black-i2650025936.html,Nike Women's Downshifter 12 Road Running Shoes - Black,2,05-08-2023
//www.lazada.sg/products/nike-mens-winflo-8-road-running-shoes-grey-i2203569800.html,Nike Men's Winflo 8 Road Running Shoes - Grey,2,05-08-2023
//www.lazada.sg/products/converse-chuck-taylor-all-star-hi-unisex-sneakers-black-i2613543050.html,Converse Chuck Taylor All Star HI Unisex Sneakers - Black,2,05-08-2023
//www.lazada.sg/products/new-balance-shoes-520-black-i2497171147.html,New Balance Shoes (520 - BLACK),2,05-08-2023
//www.lazada.sg/products/nike-mens-court-vision-low-shoes-black-i2148065781.html,Nike Men's Court Vision Low Shoes - Black,2,05-08-2023
//www.lazada.sg/products/under-armour-ua-assert-8-uniform-ac-psv-younger-kids-school-shoes-black-3022698-001-i2601004924.html,Under Armour UA Assert 8 Uniform AC (PSV) - Younger Kids School Shoes (Black) 3022698-001,2,05-08-2023
//www.lazada.sg/products/nike-mens-ebernon-low-shoes-black-i2367283182.html,Nike Men's Ebernon Low Shoes - Black,2,05-08-2023
//www.lazada.sg/products/on-men-cloud-5-all-day-wear-shoes-black-white-i2669437343.html,ON Men Cloud 5 All Day Wear Shoes - Black / White,2,05-08-2023
//www.lazada.sg/products/nike-mens-revolution-6-next-nature-running-shoes-black-i1994793953.html,Nike Men's Revolution 6 Next Nature Running Shoes - Black,2,05-08-2023
//www.lazada.sg/products/nike-womens-air-winflo-9-road-running-shoes-black-i2480498664.html,Nike Women's AIR Winflo 9 Road Running Shoes - Black,2,05-08-2023
//www.lazada.sg/products/converse-chuck-taylor-all-star-hi-unisex-sneakers-leather-black-mono-i2719494339.html,Converse Chuck Taylor All Star Hi Unisex Sneakers - Leather - Black Mono,2,05-08-2023
//www.lazada.sg/products/nike-mens-downshifter-11-running-shoes-black-i1691320764.html,Nike Men's Downshifter 11 Running Shoes - Black,2,05-08-2023
//www.lazada.sg/products/nike-mens-revolution-6-next-nature-running-shoes-black-i1994949062.html,Nike Men's Revolution 6 Next Nature Running Shoes - Black,2,05-08-2023
//www.lazada.sg/products/asics-men-jog-100t-4e-sportstyle-shoes-in-blackblack-i2474634430.html,ASICS Men JOG 100T (4E) Sportstyle Shoes in Black/Black,2,05-08-2023
//www.lazada.sg/products/adidas-tensaur-run-20-younger-kids-school-shoes-black-gz3443-i2752548314.html,Adidas Tensaur Run 2.0 - Younger Kids' School Shoes (Black) GZ3443,2,05-08-2023
//www.lazada.sg/products/puma-softride-fly-mens-running-shoes-black-i2668374592.html,PUMA Softride Fly Men's Running Shoes (Black),2,05-08-2023
//www.lazada.sg/products/puma-unisex-x-neymar-jr-wild-rider-sneaker-shoe-385048-01-sport-planet-18-13-i2620277523.html,Puma Unisex X Neymar Jr. Wild Rider Sneaker Shoe (385048-01) Sport Planet 18-13,2,05-08-2023
//www.lazada.sg/products/bata-north-star-unisex-school-shoes-581x046-i1781205249.html,BATA NORTH STAR Unisex School Shoes 581X046,2,05-08-2023
//www.lazada.sg/products/vans-authentic-unisex-sneakers-men-unisex-us-size-black-vn000ee3bka1-i1634553696.html,Vans Authentic Unisex Sneakers Men (Unisex US Size) Black VN000EE3BKA1,2,05-08-2023
//www.lazada.sg/products/bata-youth-north-star-lace-up-school-shoes-889x031-i2234110393.html,BATA Youth North Star Lace Up School Shoes 889X031,2,05-08-2023
//www.lazada.sg/products/converse-chuck-taylor-all-star-ox-unisex-sneakers-black-i2613382920.html,Converse Chuck Taylor All Star Ox Unisex Sneakers - Black,2,05-08-2023
//www.lazada.sg/products/under-armour-ua-mens-charged-escape-4-printed-running-shoes-i2690544603.html,Under Armour UA Men's Charged Escape 4 Printed Running Shoes,2,05-08-2023
//www.lazada.sg/products/adidas-running-eq19-run-shoes-men-black-gv7373-i2638998350.html,adidas Running EQ19 Run Shoes Men Black GV7373,2,05-08-2023
//www.lazada.sg/products/timberland-mens-davis-square-sneakers-black-i2815488924.html,Timberland Men's Davis Square Sneakers Black,2,05-08-2023
//www.lazada.sg/products/nike-mens-air-max-sc-shoes-black-i1737375982.html,Nike Men's Air Max SC Shoes - Black,2,05-08-2023
//www.lazada.sg/products/asics-unisex-quantum-lyte-slip-on-sportstyle-shoes-in-blackblack-i2379159692.html,ASICS Unisex QUANTUM LYTE SLIP-ON Sportstyle Shoes in Black/Black,2,05-08-2023
//www.lazada.sg/products/nike-kids-omni-multi-court-big-kids-indoor-court-shoes-black-i2715879132.html,Nike Kids' Omni Multi-Court Big Kids Indoor Court Shoes - Black,3,05-08-2023
//www.lazada.sg/products/nike-womens-court-royale-shoes-black-i2367256375.html,Nike Women's Court Royale Shoes - Black,3,05-08-2023
//www.lazada.sg/products/nike-mens-flex-experience-run-11-next-nature-road-running-shoes-black-i2715803479.html,Nike Men's Flex Experience Run 11 Next Nature Road Running Shoes - Black,3,05-08-2023
//www.lazada.sg/products/nike-mens-flex-experience-run-10-road-running-shoes-black-i2810966366.html,Nike Men's Flex Experience Run 10 Road Running Shoes - Black,3,05-08-2023
//www.lazada.sg/products/nike-mens-flex-experience-run-10-road-running-shoes-grey-i2810979261.html,Nike Men's Flex Experience Run 10 Road Running Shoes - Grey,3,05-08-2023
//www.lazada.sg/products/nike-mens-downshifter-12-road-running-shoes-black-i2585457332.html,Nike Men's Downshifter 12 Road Running Shoes - Black,3,05-08-2023
//www.lazada.sg/products/nike-mens-air-max-axis-shoes-black-i2487265910.html,Nike Men's Air Max Axis Shoes - Black,3,05-08-2023
//www.lazada.sg/products/nike-womens-downshifter-12-road-running-shoes-black-i2650025936.html,Nike Women's Downshifter 12 Road Running Shoes - Black,3,05-08-2023
//www.lazada.sg/products/puma-unisex-smash-vulcanised-v3-low-shoes-i2659292339.html,PUMA Unisex Smash Vulcanised V3 Low Shoes,3,05-08-2023
//www.lazada.sg/products/new-balance-shoes-520-black-i2497171147.html,New Balance Shoes (520 - BLACK),3,05-08-2023
//www.lazada.sg/products/nike-mens-court-vision-low-shoes-black-i2650048700.html,Nike Men's Court Vision Low Shoes - Black,3,05-08-2023
//www.lazada.sg/products/skechers-online-exclusive-men-gorun-persistence-running-shoes-246053-blyl-hyper-arc-arch-fit-carbon-infused-goodyear-rubber-ultra-flight-foam-i2448033778.html,"Skechers Online Exclusive Men GOrun Persistence Running Shoes - 246053-BLYL HYPER ARC, Arch Fit, Carbon Infused, Goodyear Rubber, Ultra Flight Foam",3,05-08-2023
//www.lazada.sg/products/nike-mens-revolution-6-next-nature-running-shoes-black-i1994949062.html,Nike Men's Revolution 6 Next Nature Running Shoes - Black,3,05-08-2023
//www.lazada.sg/products/nike-mens-ebernon-low-shoes-black-i2367283182.html,Nike Men's Ebernon Low Shoes - Black,3,05-08-2023
//www.lazada.sg/products/nike-mens-revolution-6-next-nature-running-shoes-black-i1994793953.html,Nike Men's Revolution 6 Next Nature Running Shoes - Black,3,05-08-2023
//www.lazada.sg/products/nike-mens-downshifter-11-running-shoes-black-i1691320764.html,Nike Men's Downshifter 11 Running Shoes - Black,3,05-08-2023
//www.lazada.sg/products/asics-running-shoes-i2455120016.html,Asics Running Shoes,3,05-08-2023
//www.lazada.sg/products/puma-unisex-flyer-running-shoes-i1209562997.html,PUMA Unisex Flyer Running Shoes,3,05-08-2023
//www.lazada.sg/products/adidas-running-runfalcon-20-shoes-men-black-fz2803-i1859666345.html,adidas Running Runfalcon 2.0 Shoes Men Black FZ2803,3,05-08-2023
//www.lazada.sg/products/nike-mens-court-vision-low-next-nature-shoes-black-i2585457331.html,Nike Men's Court Vision Low Next Nature Shoes - Black,3,05-08-2023
//www.lazada.sg/products/nike-womens-air-winflo-9-road-running-shoes-black-i2480498664.html,Nike Women's AIR Winflo 9 Road Running Shoes - Black,3,05-08-2023
//www.lazada.sg/products/nike-mens-court-vision-low-next-nature-shoes-black-i1889791160.html,Nike Men's Court Vision Low Next Nature Shoes - Black,3,05-08-2023
//www.lazada.sg/products/nike-womens-experience-run-11-next-nature-road-running-shoes-black-i2653167984.html,Nike Women's Experience Run 11 Next Nature Road Running Shoes - Black,3,05-08-2023
//www.lazada.sg/products/skechers-online-exclusive-men-sport-ultra-flex-20-kerlem-shoes-232108-bbk-air-cooled-memory-foam-machine-washable-i1646274881.html,Skechers Online Exclusive Men Sport Ultra Flex 2.0 Kerlem Shoes - 232108-BBK Air-Cooled Memory Foam Machine Washable,3,05-08-2023
//www.lazada.sg/products/puma-unisex-smash-v2-youth-shoes-i2659193731.html,PUMA Unisex Smash v2 Youth Shoes,3,05-08-2023
//www.lazada.sg/products/adidas-tensaur-run-20-younger-kids-school-shoes-black-gz3443-i2752548314.html,Adidas Tensaur Run 2.0 - Younger Kids' School Shoes (Black) GZ3443,3,05-08-2023
//www.lazada.sg/products/puma-unisex-smash-leather-shoes-i1165168508.html,PUMA Unisex Smash Leather Shoes,3,05-08-2023
//www.lazada.sg/products/nike-womens-revolution-6-next-nature-running-shoes-black-i2147824508.html,Nike Women's Revolution 6 Next Nature Running Shoes - Black,3,05-08-2023
//www.lazada.sg/products/nike-mens-court-vision-low-shoes-black-i2148065781.html,Nike Men's Court Vision Low Shoes - Black,3,05-08-2023
//www.lazada.sg/products/nike-mens-flight-legacy-shoes-black-i2614931058.html,Nike Men's Flight Legacy Shoes - Black,3,05-08-2023
//www.lazada.sg/products/nike-mens-downshifter-11-running-shoes-black-i1691279881.html,Nike Men's Downshifter 11 Running Shoes - Black,3,05-08-2023
//www.lazada.sg/products/nike-mens-court-royale-shoes-black-i2582504063.html,Nike Men's Court Royale Shoes - Black,3,05-08-2023
//www.lazada.sg/products/nike-mens-downshifter-12-road-running-shoes-platinum-tint-i2650134154.html,Nike Men's Downshifter 12 Road Running Shoes - Platinum Tint,3,05-08-2023
//www.lazada.sg/products/nike-womens-flex-experience-run-11-next-nature-road-running-shoes-black-i2272050993.html,Nike Women's Flex Experience Run 11 Next Nature Road Running Shoes - Black,3,05-08-2023
//www.lazada.sg/products/adidas-running-eq19-run-shoes-men-black-gv7373-i2638998350.html,adidas Running EQ19 Run Shoes Men Black GV7373,3,05-08-2023
//www.lazada.sg/products/puma-softride-fly-mens-running-shoes-black-i2668374592.html,PUMA Softride Fly Men's Running Shoes (Black),3,05-08-2023
//www.lazada.sg/products/nike-kids-revolution-6-next-nature-jp-shoes-black-i2650156020.html,Nike Kids' Revolution 6 Next Nature JP Shoes - Black,3,05-08-2023
//www.lazada.sg/products/new-balance-running-shoes-suitable-for-flat-feet-i2455131429.html,New Balance Running Shoes (Suitable for Flat Feet),3,05-08-2023
//www.lazada.sg/products/converse-chuck-taylor-all-star-hi-unisex-sneakers-black-i2613543050.html,Converse Chuck Taylor All Star HI Unisex Sneakers - Black,3,05-08-2023
//www.lazada.sg/products/nike-mens-court-legacy-suede-shoes-black-i2162189094.html,Nike Men's Court Legacy Suede Shoes - Black,3,05-08-2023
//www.lazada.sg/products/nike-womens-downshifter-12-road-running-shoes-black-i2650025936.html,Nike Women's Downshifter 12 Road Running Shoes - Black,4,05-08-2023
//www.lazada.sg/products/adidas-tensaur-run-20-younger-kids-school-shoes-black-gz3443-i2752548314.html,Adidas Tensaur Run 2.0 - Younger Kids' School Shoes (Black) GZ3443,4,05-08-2023
//www.lazada.sg/products/puma-unisex-smash-vulcanised-v3-low-shoes-i2659292339.html,PUMA Unisex Smash Vulcanised V3 Low Shoes,4,05-08-2023
//www.lazada.sg/products/skechers-online-exclusive-men-gorun-persistence-running-shoes-246053-blyl-hyper-arc-arch-fit-carbon-infused-goodyear-rubber-ultra-flight-foam-i2448033778.html,"Skechers Online Exclusive Men GOrun Persistence Running Shoes - 246053-BLYL HYPER ARC, Arch Fit, Carbon Infused, Goodyear Rubber, Ultra Flight Foam",4,05-08-2023
//www.lazada.sg/products/nike-mens-downshifter-11-running-shoes-black-i1691320764.html,Nike Men's Downshifter 11 Running Shoes - Black,4,05-08-2023
//www.lazada.sg/products/nike-womens-air-winflo-9-road-running-shoes-black-i2480498664.html,Nike Women's AIR Winflo 9 Road Running Shoes - Black,4,05-08-2023
//www.lazada.sg/products/new-balance-shoes-520-black-i2497171147.html,New Balance Shoes (520 - BLACK),4,05-08-2023
//www.lazada.sg/products/nike-mens-revolution-6-next-nature-running-shoes-black-i1994949062.html,Nike Men's Revolution 6 Next Nature Running Shoes - Black,4,05-08-2023
//www.lazada.sg/products/adidas-running-runfalcon-20-shoes-men-black-fz2803-i1859666345.html,adidas Running Runfalcon 2.0 Shoes Men Black FZ2803,4,05-08-2023
//www.lazada.sg/products/nike-mens-revolution-6-next-nature-running-shoes-black-i1994793953.html,Nike Men's Revolution 6 Next Nature Running Shoes - Black,4,05-08-2023
//www.lazada.sg/products/adidas-running-puremotion-shoes-women-black-h00589-i2426092493.html,adidas Running Puremotion Shoes Women Black H00589,4,05-08-2023
//www.lazada.sg/products/nike-mens-court-vision-low-next-nature-shoes-black-i2585457331.html,Nike Men's Court Vision Low Next Nature Shoes - Black,4,05-08-2023
//www.lazada.sg/products/nike-mens-flex-experience-run-11-next-nature-road-running-shoes-black-i2715803479.html,Nike Men's Flex Experience Run 11 Next Nature Road Running Shoes - Black,4,05-08-2023
//www.lazada.sg/products/nike-mens-downshifter-12-road-running-shoes-black-i2585457332.html,Nike Men's Downshifter 12 Road Running Shoes - Black,4,05-08-2023
//www.lazada.sg/products/puma-fusion-evo-mens-golf-shoes-black-i2752714230.html,PUMA Fusion Evo Men's Golf Shoes (Black).,4,05-08-2023
//www.lazada.sg/products/nike-womens-quest-4-running-shoes-black-i1982909491.html,Nike Women's Quest 4 Running Shoes - Black,4,05-08-2023
//www.lazada.sg/products/nike-mens-court-vision-low-shoes-black-i2650048700.html,Nike Men's Court Vision Low Shoes - Black,4,05-08-2023
//www.lazada.sg/products/converse-chuck-70-hi-unisex-sneakers-oat-milkegretblack-i2730005893.html,Converse Chuck 70 Hi Unisex Sneakers - Oat Milk/Egret/Black,4,05-08-2023
//www.lazada.sg/products/nike-mens-legend-essential-3-next-nature-training-shoes-black-i2731379096.html,Nike Men's Legend Essential 3 Next Nature Training Shoes - Black,4,05-08-2023
//www.lazada.sg/products/nike-mens-flex-spruce-aura-i1277470064.html,Nike Men's Flex  - Spruce Aura,4,05-08-2023
//www.lazada.sg/products/puma-unisex-flyer-running-shoes-i1209562997.html,PUMA Unisex Flyer Running Shoes,4,05-08-2023
//www.lazada.sg/products/craft-ctm-ultra-2-m-ash-whitglxy-1912181-895350-i2749366157.html,CRAFT CTM ULTRA 2 M ASH WHIT/GLXY  1912181-895350,4,05-08-2023
//www.lazada.sg/products/new-balance-mens-fresh-foam-arishi-v4-wide-blacktop-i2828468993.html,New Balance Mens Fresh Foam Arishi V4 (Wide) - Blacktop,4,05-08-2023
//www.lazada.sg/products/nike-womens-experience-run-11-next-nature-road-running-shoes-black-i2653167984.html,Nike Women's Experience Run 11 Next Nature Road Running Shoes - Black,4,05-08-2023
//www.lazada.sg/products/nike-mens-mc-trainer-2-training-shoes-black-i2653180819.html,Nike Men's MC Trainer 2 Training Shoes - Black,4,05-08-2023
//www.lazada.sg/products/nike-mens-ebernon-low-shoes-black-i2367283182.html,Nike Men's Ebernon Low Shoes - Black,4,05-08-2023
//www.lazada.sg/products/nike-mens-court-vision-low-next-nature-shoes-black-i1889791160.html,Nike Men's Court Vision Low Next Nature Shoes - Black,4,05-08-2023
//www.lazada.sg/products/nike-womens-revolution-6-next-nature-running-shoes-black-i2147824508.html,Nike Women's Revolution 6 Next Nature Running Shoes - Black,4,05-08-2023
//www.lazada.sg/products/nike-mens-downshifter-12-road-running-shoes-platinum-tint-i2650134154.html,Nike Men's Downshifter 12 Road Running Shoes - Platinum Tint,4,05-08-2023
//www.lazada.sg/products/nike-mens-legend-essential-3-next-nature-training-shoes-anthracite-i2653306071.html,Nike Men's Legend Essential 3 Next Nature Training Shoes - Anthracite,4,05-08-2023
//www.lazada.sg/products/nike-mens-downshifter-11-running-shoes-black-i1691279881.html,Nike Men's Downshifter 11 Running Shoes - Black,4,05-08-2023
//www.lazada.sg/products/puma-unisex-smash-v2-youth-shoes-i2659193731.html,PUMA Unisex Smash v2 Youth Shoes,4,05-08-2023
//www.lazada.sg/products/nike-kids-revolution-6-next-nature-jp-shoes-black-i2650156020.html,Nike Kids' Revolution 6 Next Nature JP Shoes - Black,4,05-08-2023
//www.lazada.sg/products/nike-mens-quest-4-road-running-shoes-black-i2614812886.html,Nike Men's Quest 4 Road Running Shoes - Black,4,05-08-2023
//www.lazada.sg/products/nike-mens-court-royale-shoes-black-i2582504063.html,Nike Men's Court Royale Shoes - Black,4,05-08-2023
//www.lazada.sg/products/nike-mens-flight-legacy-shoes-black-i2614931058.html,Nike Men's Flight Legacy Shoes - Black,4,05-08-2023
//www.lazada.sg/products/nike-womens-flex-experience-run-11-next-nature-road-running-shoes-black-i2272050993.html,Nike Women's Flex Experience Run 11 Next Nature Road Running Shoes - Black,4,05-08-2023
//www.lazada.sg/products/adidas-running-eq19-run-shoes-men-black-gv7373-i2638998350.html,adidas Running EQ19 Run Shoes Men Black GV7373,4,05-08-2023
//www.lazada.sg/products/nike-kids-court-borough-low-2-little-kids-shoes-black-i2692696878.html,Nike Kids' Court Borough Low 2 Little Kids Shoes- Black,4,05-08-2023
